[
  {
    "id": "dashboard.api.api-activity-operator-stream",
    "title": "Activity Operator-Stream",
    "apiPath": "/api/activity/operator-stream",
    "family": "activity",
    "sourceFile": "dashboard/src/app/api/activity/operator-stream/route.ts",
    "methods": [
      "GET"
    ],
    "responseMode": "unknown",
    "consumerStatus": "consumed",
    "likelyConsumers": [
      "dashboard/src/components/unified-stream.tsx",
      "dashboard/src/lib/api.ts"
    ],
    "coverage": {
      "coverageStatus": null,
      "localChecks": [],
      "liveChecks": []
    },
    "completionStatus": "live_partial",
    "notes": [
      "Discovered from filesystem API route census."
    ]
  },
  {
    "id": "dashboard.api.api-activity",
    "title": "Activity",
    "apiPath": "/api/activity",
    "family": "activity",
    "sourceFile": "dashboard/src/app/api/activity/route.ts",
    "methods": [
      "GET"
    ],
    "responseMode": "unknown",
    "consumerStatus": "consumed",
    "likelyConsumers": [
      "dashboard.route.activity",
      "dashboard/src/components/agent-detail-panel.tsx",
      "dashboard/src/components/unified-stream.tsx",
      "dashboard/src/lib/api.ts"
    ],
    "coverage": {
      "coverageStatus": null,
      "localChecks": [
        "projects/dashboard/tests/e2e/family-flows.spec.ts",
        "projects/dashboard/tests/e2e/smoke-routes.spec.ts"
      ],
      "liveChecks": [
        "scripts/tests/live-dashboard-smoke.py::routes"
      ]
    },
    "completionStatus": "live_partial",
    "notes": [
      "Discovered from filesystem API route census."
    ]
  },
  {
    "id": "dashboard.api.api-agents",
    "title": "Agents",
    "apiPath": "/api/agents",
    "family": "agents",
    "sourceFile": "dashboard/src/app/api/agents/route.ts",
    "methods": [
      "GET"
    ],
    "responseMode": "json",
    "consumerStatus": "consumed",
    "likelyConsumers": [
      "dashboard.route.agents",
      "dashboard/src/components/agent-detail-panel.tsx",
      "dashboard/src/lib/api.ts"
    ],
    "coverage": {
      "coverageStatus": null,
      "localChecks": [
        "projects/dashboard/tests/e2e/consoles.spec.ts",
        "projects/dashboard/tests/e2e/smoke-routes.spec.ts"
      ],
      "liveChecks": [
        "scripts/tests/live-dashboard-smoke.py::chat:agent-server",
        "scripts/tests/live-dashboard-smoke.py::routes"
      ]
    },
    "completionStatus": "live_partial",
    "notes": [
      "Discovered from filesystem API route census."
    ]
  },
  {
    "id": "dashboard.api.api-alerts",
    "title": "Alerts",
    "apiPath": "/api/alerts",
    "family": "alerts",
    "sourceFile": "dashboard/src/app/api/alerts/route.ts",
    "methods": [
      "GET"
    ],
    "responseMode": "unknown",
    "consumerStatus": "consumed",
    "likelyConsumers": [
      "dashboard/src/components/notifications-posture-card.tsx"
    ],
    "coverage": {
      "coverageStatus": null,
      "localChecks": [],
      "liveChecks": []
    },
    "completionStatus": "live_partial",
    "notes": [
      "Discovered from filesystem API route census."
    ]
  },
  {
    "id": "dashboard.api.api-autonomy",
    "title": "Autonomy",
    "apiPath": "/api/autonomy",
    "family": "autonomy",
    "sourceFile": "dashboard/src/app/api/autonomy/route.ts",
    "methods": [
      "GET"
    ],
    "responseMode": "unknown",
    "consumerStatus": "consumed",
    "likelyConsumers": [
      "dashboard/src/components/agent-detail-panel.tsx"
    ],
    "coverage": {
      "coverageStatus": null,
      "localChecks": [],
      "liveChecks": []
    },
    "completionStatus": "live_partial",
    "notes": [
      "Discovered from filesystem API route census."
    ]
  },
  {
    "id": "dashboard.api.api-chat",
    "title": "Chat",
    "apiPath": "/api/chat",
    "family": "chat",
    "sourceFile": "dashboard/src/app/api/chat/route.ts",
    "methods": [
      "POST"
    ],
    "responseMode": "sse",
    "consumerStatus": "consumed",
    "likelyConsumers": [
      "dashboard.route.agents",
      "dashboard.route.chat",
      "dashboard/src/features/agents/agent-console.tsx",
      "dashboard/src/features/chat/direct-chat-console.tsx"
    ],
    "coverage": {
      "coverageStatus": "covered-live",
      "localChecks": [
        "projects/dashboard/tests/e2e/consoles.spec.ts",
        "projects/dashboard/tests/e2e/smoke-routes.spec.ts"
      ],
      "liveChecks": [
        "scripts/tests/live-dashboard-smoke.py::chat:agent-server",
        "scripts/tests/live-dashboard-smoke.py::chat:litellm-proxy",
        "scripts/tests/live-dashboard-smoke.py::chat:workshop-worker",
        "scripts/tests/live-dashboard-smoke.py::routes"
      ]
    },
    "completionStatus": "live_complete",
    "notes": [
      "Discovered from filesystem API route census."
    ]
  },
  {
    "id": "dashboard.api.api-comfyui-generate",
    "title": "Comfyui Generate",
    "apiPath": "/api/comfyui/generate",
    "family": "comfyui",
    "sourceFile": "dashboard/src/app/api/comfyui/generate/route.ts",
    "methods": [
      "POST"
    ],
    "responseMode": "json",
    "consumerStatus": "support-only",
    "likelyConsumers": [],
    "coverage": {
      "coverageStatus": "covered-automated",
      "localChecks": [],
      "liveChecks": []
    },
    "completionStatus": "implemented_not_live",
    "notes": [
      "Discovered from filesystem API route census.",
      "Support-only, test-harness, or ambient API surface."
    ]
  },
  {
    "id": "dashboard.api.api-comfyui-history",
    "title": "Comfyui History",
    "apiPath": "/api/comfyui/history",
    "family": "comfyui",
    "sourceFile": "dashboard/src/app/api/comfyui/history/route.ts",
    "methods": [
      "GET"
    ],
    "responseMode": "json",
    "consumerStatus": "consumed",
    "likelyConsumers": [
      "dashboard.route.gallery"
    ],
    "coverage": {
      "coverageStatus": "covered-automated",
      "localChecks": [
        "projects/dashboard/tests/e2e/family-flows.spec.ts",
        "projects/dashboard/tests/e2e/smoke-routes.spec.ts"
      ],
      "liveChecks": [
        "scripts/tests/live-dashboard-smoke.py::routes"
      ]
    },
    "completionStatus": "live_partial",
    "notes": [
      "Discovered from filesystem API route census."
    ]
  },
  {
    "id": "dashboard.api.api-comfyui-image-path",
    "title": "Comfyui Image Path Wildcard",
    "apiPath": "/api/comfyui/image/:path*",
    "family": "comfyui",
    "sourceFile": "dashboard/src/app/api/comfyui/image/[...path]/route.ts",
    "methods": [
      "GET"
    ],
    "responseMode": "unknown",
    "consumerStatus": "consumed",
    "likelyConsumers": [
      "dashboard.route.gallery"
    ],
    "coverage": {
      "coverageStatus": null,
      "localChecks": [
        "projects/dashboard/tests/e2e/family-flows.spec.ts",
        "projects/dashboard/tests/e2e/smoke-routes.spec.ts"
      ],
      "liveChecks": [
        "scripts/tests/live-dashboard-smoke.py::routes"
      ]
    },
    "completionStatus": "live_partial",
    "notes": [
      "Discovered from filesystem API route census."
    ]
  },
  {
    "id": "dashboard.api.api-comfyui-queue",
    "title": "Comfyui Queue",
    "apiPath": "/api/comfyui/queue",
    "family": "comfyui",
    "sourceFile": "dashboard/src/app/api/comfyui/queue/route.ts",
    "methods": [
      "GET"
    ],
    "responseMode": "json",
    "consumerStatus": "support-only",
    "likelyConsumers": [],
    "coverage": {
      "coverageStatus": "covered-automated",
      "localChecks": [],
      "liveChecks": []
    },
    "completionStatus": "implemented_not_live",
    "notes": [
      "Discovered from filesystem API route census.",
      "Support-only, test-harness, or ambient API surface."
    ]
  },
  {
    "id": "dashboard.api.api-comfyui-stats",
    "title": "Comfyui Stats",
    "apiPath": "/api/comfyui/stats",
    "family": "comfyui",
    "sourceFile": "dashboard/src/app/api/comfyui/stats/route.ts",
    "methods": [
      "GET"
    ],
    "responseMode": "json",
    "consumerStatus": "support-only",
    "likelyConsumers": [],
    "coverage": {
      "coverageStatus": "covered-automated",
      "localChecks": [],
      "liveChecks": []
    },
    "completionStatus": "implemented_not_live",
    "notes": [
      "Discovered from filesystem API route census.",
      "Support-only, test-harness, or ambient API surface."
    ]
  },
  {
    "id": "dashboard.api.api-consolidation",
    "title": "Consolidation",
    "apiPath": "/api/consolidation",
    "family": "consolidation",
    "sourceFile": "dashboard/src/app/api/consolidation/route.ts",
    "methods": [
      "POST"
    ],
    "responseMode": "unknown",
    "consumerStatus": "consumed",
    "likelyConsumers": [
      "dashboard/src/components/consolidation-card.tsx"
    ],
    "coverage": {
      "coverageStatus": null,
      "localChecks": [],
      "liveChecks": []
    },
    "completionStatus": "live_partial",
    "notes": [
      "Discovered from filesystem API route census."
    ]
  },
  {
    "id": "dashboard.api.api-consolidation-stats",
    "title": "Consolidation Stats",
    "apiPath": "/api/consolidation/stats",
    "family": "consolidation",
    "sourceFile": "dashboard/src/app/api/consolidation/stats/route.ts",
    "methods": [
      "GET"
    ],
    "responseMode": "unknown",
    "consumerStatus": "consumed",
    "likelyConsumers": [
      "dashboard/src/components/consolidation-card.tsx"
    ],
    "coverage": {
      "coverageStatus": null,
      "localChecks": [],
      "liveChecks": []
    },
    "completionStatus": "live_partial",
    "notes": [
      "Discovered from filesystem API route census."
    ]
  },
  {
    "id": "dashboard.api.api-context-preview",
    "title": "Context Preview",
    "apiPath": "/api/context/preview",
    "family": "context",
    "sourceFile": "dashboard/src/app/api/context/preview/route.ts",
    "methods": [
      "POST"
    ],
    "responseMode": "unknown",
    "consumerStatus": "consumed",
    "likelyConsumers": [